{
  "version_rubrica": "4.0",
  "criterios": {
    "genuino": {
      "puntaje": 2,
      "justificacion": "Justificación de ejemplo para genuino.",
      "cita": "¿Tienen razón? Pueden pedir información adicional."
    },
    "abierta": {
      "puntaje": 2,
      "justificacion": "Justificación de ejemplo para abierta.",
      "cita": "¿Tienen razón? Pueden pedir información adicional."
    },
    "decisiones": {
      "puntaje": 2,
      "justificacion": "Justificación de ejemplo para decisiones.",
      "cita": "¿Tienen razón? Pueden pedir información adicional."
    },
    "realismo": {
      "puntaje": 2,
      "justificacion": "Justificación de ejemplo para realismo.",
      "cita": "¿Tienen razón? Pueden pedir información adicional."
    },
    "autenticidad": {
      "puntaje": 2,
      "justificacion": "Justificación de ejemplo para autenticidad.",
      "cita": "¿Tienen razón? Pueden pedir información adicional."
    },
    "contexto": {
      "puntaje": 2,
      "justificacion": "Justificación de ejemplo para contexto.",
      "cita": "¿Tienen razón? Pueden pedir información adicional."
    },
    "ciclo": {
      "puntaje": 2,
      "justificacion": "Justificación de ejemplo para ciclo.",
      "cita": "¿Tienen razón? Pueden pedir información adicional."
    },
    "validacion": {
      "puntaje": 1,
      "justificacion": "Justificación de ejemplo para validacion.",
      "cita": "¿Tienen razón? Pueden pedir información adicional."
    },
    "nivel": {
      "puntaje": 2,
      "justificacion": "Justificación de ejemplo para nivel.",
      "cita": "¿Tienen razón? Pueden pedir información adicional."
    },
    "autodiferenciacion": {
      "puntaje": 2,
      "justificacion": "Justificación de ejemplo para autodiferenciacion.",
      "cita": "¿Tienen razón? Pueden pedir información adicional."
    },
    "fecundidad": {
      "puntaje": 2,
      "justificacion": "Justificación de ejemplo para fecundidad.",
      "cita": "¿Tienen razón? Pueden pedir información adicional."
    },
    "recursos": {
      "puntaje": 2,
      "justificacion": "Justificación de ejemplo para recursos.",
      "cita": "¿Tienen razón? Pueden pedir información adicional."
    }
  },
  "total": 23,
  "mejoras": [
    {
      "criterio": "validacion",
      "mejora_minima": "Indicar que existe un dato posterior con el cual contrastar."
    }
  ]
}
